{
  "id": "wb_01Q4N9GHG0208H248H248H248G",
  "expected_revision": "sha256:aef0720e5f587b9eed6e6108e9116b2c546c11749cb5c5dc6bea97a26ae7b7ba",
  "to_status": "done",
  "date": "2030-01-20",
  "decision": {
    "summary": "Complete the fictional constellation survey.",
    "rationale": "Every direct synthetic child is terminal."
  }
}
