{
  "id": "wb_01Q4G4Q3G0207EXVQEXVQEXVQE",
  "expected_revision": "sha256:01b2d68f8c93f05541c06e8c3bc14c676c105879b3fbb175e886e8e132c267af",
  "to_status": "done",
  "date": "2030-01-16",
  "decision": {
    "summary": "Complete the fictional aurora index.",
    "rationale": "The isolated fictional acceptance evidence is complete."
  }
}
