{
  "id": "wb_01Q59WP9G020CSK6CSK6CSK6CR",
  "expected_revision": "sha256:f3f42acec721f66da376e704fa526c1d1872852ceba6f9eccc3c209595befdba",
  "to_status": "done",
  "date": "2030-01-26",
  "decision": {
    "summary": "Complete the fictional chronometer.",
    "rationale": "The synthetic chronometer work is complete."
  }
}
